{
  "linguistic_snapshot_version": "linguistic_snapshot.v1",
  "gene": "run_ledger_binding_organ",
  "captured_at": "2026-06-03T09:53:11Z",
  "capture_source": "naming-genome-gate",
  "genome_stage": "governed",
  "layers": {
    "genome": {
      "gene": "run_ledger_binding_organ",
      "engineering_class": "RunLedgerBindingEngine",
      "mythic_label": "Run Ledger Binding Organ",
      "linguistic_version": "1.0.0",
      "display_name": "Run Ledger Binding Organ",
      "module_path": "src/run_ledger_binding_organ.py"
    },
    "source": {
      "path": "E:/project-infi/src/run_ledger_binding_organ.py",
      "header": {},
      "symbols": []
    },
    "docs": {
      "concept_spec": {
        "title": "Run Ledger Binding Organ"
      },
      "active_doc": {
        "title": "Run Ledger Binding Organ"
      }
    }
  },
  "fingerprints": {
    "mythic": "4b2a7d3d11989df7acf98e7a1439b8dc6f9c2771f9d5ba89cca9e5c3ac80ce01",
    "engineering": "b3bdaaac7a3eca35fdbd21e146d508433ff0e29ffd3ff10f8e01e1686ccab109",
    "combined": "07ae2a5d462f6360694111ca3f41a8c6665176fcede760bfca49689f34117da3"
  }
}
