{
  "linguistic_snapshot_version": "linguistic_snapshot.v1",
  "gene": "planning_organ",
  "captured_at": "2026-06-03T09:53:11Z",
  "capture_source": "naming-genome-gate",
  "genome_stage": "governed",
  "layers": {
    "genome": {
      "gene": "planning_organ",
      "engineering_class": "PlanningEngine",
      "mythic_label": "Planning Organ",
      "linguistic_version": "1.0.0",
      "display_name": "Planning Organ",
      "module_path": "src/planning_organ.py"
    },
    "source": {
      "path": "E:/project-infi/src/planning_organ.py",
      "header": {},
      "symbols": []
    },
    "docs": {
      "concept_spec": {
        "title": "Planning Organ"
      },
      "active_doc": {
        "title": "Planning Organ"
      }
    }
  },
  "fingerprints": {
    "mythic": "d3c09cfab349c1f0647c9d064b09a86d3b7b1eafa44abfbe24a10de21a9390a3",
    "engineering": "946e14eb417aa202df54b680f4714d223db0f273c9870feb9200fa3734667afe",
    "combined": "84e1c57e7aa193d0344c3a281916cc3f560feb3b4da01dfe7a9602b3ddf012f6"
  }
}
