{
  "linguistic_snapshot_version": "linguistic_snapshot.v1",
  "gene": "narrative_continuity_organ",
  "captured_at": "2026-06-03T09:53:10Z",
  "capture_source": "naming-genome-gate",
  "genome_stage": "governed",
  "layers": {
    "genome": {
      "gene": "narrative_continuity_organ",
      "engineering_class": "NarrativeContinuityEngine",
      "mythic_label": "Narrative Continuity Organ",
      "linguistic_version": "1.0.0",
      "display_name": "Narrative Continuity Organ",
      "module_path": "src/narrative_continuity_organ.py"
    },
    "source": {
      "path": "E:/project-infi/src/narrative_continuity_organ.py",
      "header": {},
      "symbols": []
    },
    "docs": {
      "concept_spec": {
        "title": "Narrative Continuity Organ"
      },
      "active_doc": {
        "title": "Narrative Continuity Organ"
      }
    }
  },
  "fingerprints": {
    "mythic": "4e66061a35e47c8b2490e356e6dcd37e35074c70e510ebda2233fcc651efc075",
    "engineering": "a18f61ffc102ab3b4b5889c0d8c0b71b542a3e0857b9945a430f2cdd54c5acd6",
    "combined": "f2166f39953339975760b0d889056a2441781f2e3257b23f879de73ff44e8ee6"
  }
}
